{
  "schema_version": "1",
  "status": "complete",
  "scan_id": "c1000000-0000-0000-0000-000000000001",
  "target": {
    "raw": "https://example.com",
    "url": "https://example.com/",
    "scheme": "https",
    "host": "example.com",
    "domain": "example.com",
    "port": 443
  },
  "snapshot": {
    "schema_version": "1",
    "fingerprint": "1a2b3c4d5e6f7a8b9c0d1e2f3a4b5c6d7e8f9a0b1c2d3e4f5a6b7c8d9e0f1a2b",
    "target": {
      "raw": "https://example.com",
      "url": "https://example.com/",
      "scheme": "https",
      "host": "example.com",
      "domain": "example.com",
      "port": 443
    },
    "captured_at": "2025-03-01T12:00:00Z",
    "assets": [
      {
        "id": "a1b2c3d4e5f60001",
        "kind": "hostname",
        "value": "example.com"
      }
    ],
    "observations": [
      {
        "id": "o1b2c3d4e5f60001",
        "kind": "dns_record",
        "scope": "dns",
        "subject": "example.com",
        "data": {
          "record_type": "A",
          "value": "93.184.216.34"
        }
      },
      {
        "id": "o1b2c3d4e5f60002",
        "kind": "tls_certificate",
        "scope": "tls",
        "subject": "example.com",
        "data": {
          "days_until_expire": 54,
          "fingerprint_sha256": "abcdef123456",
          "verification_status": "valid"
        }
      }
    ],
    "findings": [
      {
        "id": "f1b2c3d4e5f60001",
        "check_id": "http.root",
        "rule_id": "http.missing_hsts",
        "severity": "low",
        "confidence": "high",
        "title": "Missing Strict-Transport-Security Header",
        "description": "HTTPS website lacks HSTS header.",
        "asset": "https://example.com/",
        "remediation": "Add HSTS header."
      }
    ],
    "summary": {
      "total_assets": 1,
      "total_observations": 2,
      "total_findings": 1,
      "critical_findings": 0,
      "high_findings": 0,
      "medium_findings": 0,
      "low_findings": 1,
      "info_findings": 0
    }
  },
  "changes": [],
  "summary": {
    "assets_discovered": 1,
    "total_observations": 2,
    "total_findings": 1,
    "total_changes": 0,
    "total_duration": 500000000
  },
  "started_at": "2025-03-01T12:00:00Z",
  "completed_at": "2025-03-01T12:00:00.510Z",
  "errors": []
}
